{
  "schema_version": "0.2",
  "type": "connector",
  "catalog_id": "142",
  "catalog_key": "connector.train.lookup",
  "catalog_kind": "connector",
  "runtime_key": "train.lookup",
  "status": "active",
  "title": "Train Lookup",
  "source": {
    "repository": "https://github.com/wrangleworks/WranglesPY",
    "revision": "bd5f88fba479ec406b409cb2880689c54e72b298",
    "version": "1.20.5",
    "extraction": "static-python-ast"
  },
  "operations": {
    "read": {
      "type": "object",
      "description": "Read the training data for a Lookup Wrangle",
      "additionalProperties": false,
      "required": [
        "model_id"
      ],
      "properties": {
        "model_id": {
          "type": "string",
          "description": "Specific model to read"
        },
        "columns": {
          "$ref": "https://docs.wrangles.com/schemas/recipes/registry/schema.json#/$defs/write/commonProperties/columns"
        },
        "not_columns": {
          "$ref": "https://docs.wrangles.com/schemas/recipes/registry/schema.json#/$defs/write/commonProperties/not_columns"
        },
        "where": {
          "$ref": "https://docs.wrangles.com/schemas/recipes/registry/schema.json#/$defs/write/commonProperties/where"
        },
        "where_params": {
          "$ref": "https://docs.wrangles.com/schemas/recipes/registry/schema.json#/$defs/write/commonProperties/where_params"
        },
        "order_by": {
          "$ref": "https://docs.wrangles.com/schemas/recipes/registry/schema.json#/$defs/write/commonProperties/order_by"
        },
        "if": {
          "$ref": "https://docs.wrangles.com/schemas/recipes/registry/schema.json#/$defs/write/commonProperties/if"
        }
      }
    },
    "write": {
      "type": "object",
      "description": "Train a new or existing Lookup Wrangle",
      "additionalProperties": false,
      "properties": {
        "name": {
          "type": "string",
          "description": "Name to give to a new Wrangle that will be created"
        },
        "model_id": {
          "type": "string",
          "description": "Model to be updated. Either this or a name must be provided"
        },
        "columns": {
          "$ref": "https://docs.wrangles.com/schemas/recipes/registry/schema.json#/$defs/write/commonProperties/columns"
        },
        "variant": {
          "type": "string",
          "description": "Variant of the Lookup Wrangle that will be created",
          "enum": [
            "key",
            "semantic"
          ]
        },
        "not_columns": {
          "$ref": "https://docs.wrangles.com/schemas/recipes/registry/schema.json#/$defs/write/commonProperties/not_columns"
        },
        "where": {
          "$ref": "https://docs.wrangles.com/schemas/recipes/registry/schema.json#/$defs/write/commonProperties/where"
        },
        "where_params": {
          "$ref": "https://docs.wrangles.com/schemas/recipes/registry/schema.json#/$defs/write/commonProperties/where_params"
        },
        "order_by": {
          "$ref": "https://docs.wrangles.com/schemas/recipes/registry/schema.json#/$defs/write/commonProperties/order_by"
        },
        "if": {
          "$ref": "https://docs.wrangles.com/schemas/recipes/registry/schema.json#/$defs/write/commonProperties/if"
        }
      },
      "action": {
        "type": "string",
        "description": "Action to take when training the lookup wrangle",
        "enum": [
          "insert",
          "update",
          "upsert",
          "overwrite"
        ]
      }
    }
  },
  "description": "Read the training data for a Lookup Wrangle",
  "slug": "connectors/train.lookup",
  "visibility": "public",
  "sources": [
    {
      "id": "runtime",
      "resource": "https://github.com/wrangleworks/WranglesPY/tree/bd5f88fba479ec406b409cb2880689c54e72b298",
      "title": "Pinned WranglesPY connector schema"
    },
    {
      "id": "existing-docs",
      "resource": "wrangles-docs/registry-docs/python/connectors/train.md#lookup",
      "title": "Existing connector documentation"
    }
  ],
  "guidance": "### Read\n#### Recipe\n```yaml\nread:\n  - train.lookup:\n      model_id: xxxxxxxx-xxxx-xxxx\n```\n\n##### Output\n\n<div className=\"table-scroll\">\n\n| Key | Value1 | Value2 |\n| :--- | :------ | :---- |\n| Pizza | Thin Crust | Deep Dish |\n| Hamburger | Single | Double |\n| Salad | Garden | Ceasar |\n| Taco | Soft | Crispy |\n\n</div>\n\n#### Function\n```python\nfrom wrangles.connectors import train\ndf = train.lookup.read(model_id = 'xxxxxxxx-xxxx-xxxx')\n```\n\n##### Output\n\n<div className=\"table-scroll\">\n\n| Key | Value1 | Value2 |\n| :--- | :------ | :---- |\n| Pizza | Thin Crust | Deep Dish |\n| Hamburger | Single | Double |\n| Salad | Garden | Ceasar |\n| Taco | Soft | Crispy |\n\n</div>\n\n### Write\n#### Recipe\nUpdate the training data for an existing lookup wrangle.\n\n```yaml\nwrite:\n  - train.lookup:\n      model_id: xxxxxxxx-xxxx-xxxx\n```\n\n#### Function\nCreate a new lookup wrangle.\n```python\nfrom wrangles.connectors import train\nimport pandas as pd\n\ndf = pd.DataFrame({\n\t\t'Key': ['Pizza', 'Hamburger', 'Salad', 'Taco'],\n    'Value1': ['Thin Crust', 'Single', 'Garden', 'Soft'],\n    'Value2': ['Deep Dish', 'Double', 'Ceasar', 'Crispy']\n})\n\ntrain.lookup.write(df = df, name = 'Menu Updates', settings = {'variant': 'key'})\n```\n\n> Note both name and model_id **cannot** be used together. Name is used when creating models and model_id is used when updating an existing model."
}
