{
  "schema_version": "0.2",
  "type": "connector",
  "catalog_id": "121",
  "catalog_key": "connector.mssql",
  "catalog_kind": "connector",
  "runtime_key": "mssql",
  "status": "active",
  "title": "MSSQL",
  "source": {
    "repository": "https://github.com/wrangleworks/WranglesPY",
    "revision": "bd5f88fba479ec406b409cb2880689c54e72b298",
    "version": "1.20.5",
    "extraction": "static-python-ast"
  },
  "operations": {
    "read": {
      "type": "object",
      "description": "Import data from a Microsoft SQL Server",
      "required": [
        "host",
        "user",
        "password",
        "command"
      ],
      "properties": {
        "host": {
          "type": "string",
          "description": "Hostname or IP address of the server"
        },
        "user": {
          "type": "string",
          "description": "The user to connect to the database with"
        },
        "password": {
          "type": "string",
          "description": "Password for the specified user"
        },
        "command": {
          "type": "string",
          "description": "Table name or SQL command to select data.\nNote - using variables here can make your recipe vulnerable\nto sql injection. Use params if using variables from\nuntrusted sources."
        },
        "database": {
          "type": "string",
          "description": "The database to connect to"
        },
        "port": {
          "type": "integer",
          "description": "The Port to connect to. Defaults to 1433."
        },
        "columns": {
          "$ref": "https://docs.wrangles.com/schemas/recipes/registry/schema.json#/$defs/write/commonProperties/columns"
        },
        "params": {
          "type": [
            "array",
            "object"
          ],
          "description": "List of parameters to pass to execute method.\nThis may use %s or %(name)s syntax"
        },
        "not_columns": {
          "$ref": "https://docs.wrangles.com/schemas/recipes/registry/schema.json#/$defs/write/commonProperties/not_columns"
        },
        "where": {
          "$ref": "https://docs.wrangles.com/schemas/recipes/registry/schema.json#/$defs/write/commonProperties/where"
        },
        "where_params": {
          "$ref": "https://docs.wrangles.com/schemas/recipes/registry/schema.json#/$defs/write/commonProperties/where_params"
        },
        "order_by": {
          "$ref": "https://docs.wrangles.com/schemas/recipes/registry/schema.json#/$defs/write/commonProperties/order_by"
        },
        "if": {
          "$ref": "https://docs.wrangles.com/schemas/recipes/registry/schema.json#/$defs/write/commonProperties/if"
        }
      }
    },
    "run": {
      "type": "object",
      "description": "Run a command against a Microsoft SQL Server such as triggering a query or stored procedure",
      "required": [
        "host",
        "user",
        "password",
        "command"
      ],
      "properties": {
        "host": {
          "type": "string",
          "description": "Hostname or IP address of the server"
        },
        "user": {
          "type": "string",
          "description": "The user to connect to the server with"
        },
        "password": {
          "type": "string",
          "description": "Password for the specified user"
        },
        "command": {
          "type": [
            "string",
            "array"
          ],
          "description": "SQL command or a list of SQL commands to execute"
        },
        "database": {
          "type": "string",
          "description": "The database to connect to"
        },
        "port": {
          "type": "integer",
          "description": "The Port to connect to. Defaults to 1433."
        },
        "params": {
          "type": [
            "array",
            "object"
          ],
          "description": "Variables to pass to a parameterized query.\nThis may use %s or %(name)s syntax"
        },
        "if": {
          "$ref": "https://docs.wrangles.com/schemas/recipes/registry/schema.json#/$defs/run/commonProperties/if"
        }
      }
    },
    "write": {
      "type": "object",
      "description": "Write data to a Microsoft SQL Server",
      "required": [
        "host",
        "user",
        "password",
        "database",
        "table"
      ],
      "properties": {
        "host": {
          "type": "string",
          "description": "Hostname or IP address of the server"
        },
        "user": {
          "type": "string",
          "description": "The user to connect to the database with"
        },
        "password": {
          "type": "string",
          "description": "Password for the specified user"
        },
        "database": {
          "type": "string",
          "description": "The database to connect to"
        },
        "table": {
          "type": "string",
          "description": "The name of the table to insert the data into"
        },
        "port": {
          "type": "integer",
          "description": "The Port to connect to. Defaults to 1433."
        },
        "columns": {
          "$ref": "https://docs.wrangles.com/schemas/recipes/registry/schema.json#/$defs/write/commonProperties/columns"
        },
        "not_columns": {
          "$ref": "https://docs.wrangles.com/schemas/recipes/registry/schema.json#/$defs/write/commonProperties/not_columns"
        },
        "where": {
          "$ref": "https://docs.wrangles.com/schemas/recipes/registry/schema.json#/$defs/write/commonProperties/where"
        },
        "where_params": {
          "$ref": "https://docs.wrangles.com/schemas/recipes/registry/schema.json#/$defs/write/commonProperties/where_params"
        },
        "order_by": {
          "$ref": "https://docs.wrangles.com/schemas/recipes/registry/schema.json#/$defs/write/commonProperties/order_by"
        },
        "if": {
          "$ref": "https://docs.wrangles.com/schemas/recipes/registry/schema.json#/$defs/write/commonProperties/if"
        }
      }
    }
  },
  "description": "Import data from a Microsoft SQL Server",
  "slug": "connectors/mssql",
  "visibility": "public",
  "sources": [
    {
      "id": "runtime",
      "resource": "https://github.com/wrangleworks/WranglesPY/tree/bd5f88fba479ec406b409cb2880689c54e72b298",
      "title": "Pinned WranglesPY connector schema"
    },
    {
      "id": "existing-docs",
      "resource": "wrangles-docs/registry-docs/python/connectors/mssql.md",
      "title": "Existing connector documentation"
    }
  ],
  "guidance": "The mssql connector supports read and writing to/from a Microsoft SQL Server.\n\n### Read\n### Recipe\n```yaml\nread:\n  - mssql:\n      host: sql.domain\n      user: user\n      password: password\n      command: |\n        SELECT *\n        FROM table\n\n      # Optional\n      port: 1433\n      database: database\n      columns:\n        - column1\n        - column2\n```\n\n### Function\n```python\nfrom wrangles.connectors import mssql\ndf = mssql.read(\n      host = 'sql.domain',\n      user = 'user',\n      password = 'password',\n      command = 'SELECT * FROM table'\n)\n```\n\n### Write\n### Recipe\n```yaml\nwrite:\n  - mssql:\n      host: sql.domain\n      database: database\n      table: table\n      user: user\n      password: password\n\n      # Optional\n      port: 1433\n      columns:\n        - column1\n        - column2\n```\n\n### Function\n```python\nfrom wrangles.connectors import mssql\nmssql.write(\n    df,\n    host = 'sql.domain',\n    database = 'database',\n    table = 'table',\n    user = 'user',\n    password = 'password'\n)\n```\n\n### Run\n\n> Added **v0.5**\n\nRun a SQL command. For example, this can be used to trigger a stored procedure or move/transform data before or after the recipe is executed.\n\n### Recipe\n```yaml\nrun:\n  on_start:\n    - mssql:\n        host: sql.domain\n        user: user\n        password: password\n        command: EXEC [StoredProc]\n\n        # Optional\n        database: database\n        port: 1433\n```\n\n### Function\n```python\nfrom wrangles.connectors import mssql\nmssql.run(\n    host = 'sql.domain',\n    user = 'user',\n    password = 'password',\n    command = 'EXEC [StoredProc]',\n    database = 'database'\n)\n```"
}
