{
  "schema_version": "0.2",
  "type": "connector",
  "catalog_id": "134",
  "catalog_key": "connector.sftp",
  "catalog_kind": "connector",
  "runtime_key": "sftp",
  "status": "active",
  "title": "SFTP",
  "source": {
    "repository": "https://github.com/wrangleworks/WranglesPY",
    "revision": "bd5f88fba479ec406b409cb2880689c54e72b298",
    "version": "1.20.5",
    "extraction": "static-python-ast"
  },
  "operations": {
    "read": {
      "type": "object",
      "description": "Import a file from an SFTP server",
      "required": [
        "host",
        "user",
        "password",
        "file"
      ],
      "properties": {
        "host": {
          "type": "string",
          "description": "The domain or IP of the SFTP server"
        },
        "user": {
          "type": "string",
          "description": "The user to connect as"
        },
        "password": {
          "type": "string",
          "description": "The password for the user"
        },
        "file": {
          "type": "string",
          "description": "The filename including path on the remote server"
        },
        "columns": {
          "$ref": "https://docs.wrangles.com/schemas/recipes/registry/schema.json#/$defs/write/commonProperties/columns"
        },
        "nrows": {
          "type": "integer",
          "description": "Number of rows to read",
          "minimum": 1
        },
        "header": {
          "type": "integer",
          "description": "Set the header row number.",
          "minimum": 0
        },
        "sheet_name": {
          "type": "string",
          "description": "Used for Excel files. Specify the sheet to read."
        },
        "orient": {
          "type": "string",
          "description": "Used for JSON files. Specifies the input arrangement",
          "enum": [
            "split",
            "records",
            "index",
            "columns",
            "values"
          ]
        },
        "not_columns": {
          "$ref": "https://docs.wrangles.com/schemas/recipes/registry/schema.json#/$defs/write/commonProperties/not_columns"
        },
        "where": {
          "$ref": "https://docs.wrangles.com/schemas/recipes/registry/schema.json#/$defs/write/commonProperties/where"
        },
        "where_params": {
          "$ref": "https://docs.wrangles.com/schemas/recipes/registry/schema.json#/$defs/write/commonProperties/where_params"
        },
        "order_by": {
          "$ref": "https://docs.wrangles.com/schemas/recipes/registry/schema.json#/$defs/write/commonProperties/order_by"
        },
        "if": {
          "$ref": "https://docs.wrangles.com/schemas/recipes/registry/schema.json#/$defs/write/commonProperties/if"
        }
      }
    },
    "write": {
      "type": "object",
      "description": "Export a file to an SFTP server",
      "required": [
        "host",
        "user",
        "password",
        "file"
      ],
      "properties": {
        "host": {
          "type": "string",
          "description": "The domain or IP of the SFTP server"
        },
        "user": {
          "type": "string",
          "description": "The user to connect as"
        },
        "password": {
          "type": "string",
          "description": "The password for the user"
        },
        "file": {
          "type": "string",
          "description": "The filename including path on the remote server"
        },
        "columns": {
          "$ref": "https://docs.wrangles.com/schemas/recipes/registry/schema.json#/$defs/write/commonProperties/columns"
        },
        "sheet_name": {
          "type": "string",
          "description": "Used for Excel files. Specify the sheet to create."
        },
        "orient": {
          "type": "string",
          "description": "Used for JSON files. Specifies the output arrangement",
          "enum": [
            "split",
            "records",
            "index",
            "columns",
            "values"
          ]
        },
        "not_columns": {
          "$ref": "https://docs.wrangles.com/schemas/recipes/registry/schema.json#/$defs/write/commonProperties/not_columns"
        },
        "where": {
          "$ref": "https://docs.wrangles.com/schemas/recipes/registry/schema.json#/$defs/write/commonProperties/where"
        },
        "where_params": {
          "$ref": "https://docs.wrangles.com/schemas/recipes/registry/schema.json#/$defs/write/commonProperties/where_params"
        },
        "order_by": {
          "$ref": "https://docs.wrangles.com/schemas/recipes/registry/schema.json#/$defs/write/commonProperties/order_by"
        },
        "if": {
          "$ref": "https://docs.wrangles.com/schemas/recipes/registry/schema.json#/$defs/write/commonProperties/if"
        }
      }
    }
  },
  "description": "Import a file from an SFTP server",
  "slug": "connectors/sftp",
  "visibility": "public",
  "sources": [
    {
      "id": "runtime",
      "resource": "https://github.com/wrangleworks/WranglesPY/tree/bd5f88fba479ec406b409cb2880689c54e72b298",
      "title": "Pinned WranglesPY connector schema"
    },
    {
      "id": "existing-docs",
      "resource": "wrangles-docs/registry-docs/python/connectors/sftp.md",
      "title": "Existing connector documentation"
    }
  ],
  "guidance": "The sftp connector supports reading and writing CSV, Excel and JSON files to & from an SFTP server.\n\n### Read\n### Recipe\n```yaml\nread:\n  - sftp:\n      host: sftp.domain\n      user: user\n      password: password\n      file: file.csv\n\n      # Optional\n      columns:             # Only import select columns\n        - column1\n        - column2\n      sheet_name: Sheet1   # Used for Excel files\n      nrows: 10            # Limit the number of rows\n      orient: records      # Used for JSON files - defines the structure\n```\n\n### Function\n```python\nfrom wrangles.connectors import sftp\ndf = sftp.read(\n    host='sftp.domain',\n    user='user',\n    password='password',\n    file='myfile.csv'\n)\n```\n\n> The SFTP connector also supports the same optional parameters as the file connector. See the [file connector](/py/connectors/file) for more details.\n\n### Write\n### Recipe\n```yaml\n# Write specific fields\nwrite:\n  - sftp:\n      host: sftp.domain\n      user: user\n      password: password\n      file: file.csv\n\n      # Optional\n      columns:\n        - column1\n        - column2\n```\n\n### Function\n```python\nfrom wrangles.connectors import sftp\nsftp.write(\n    df,\n    host='sftp.domain',\n    user='user',\n    password='password',\n    file='myfile.csv'\n)\n```\n\n> The SFTP connector also supports the same optional parameters as the file connector. See the [file connector](/py/connectors/file) for more details."
}
