{
  "schema_version": "0.2",
  "type": "connector",
  "catalog_id": "114",
  "catalog_key": "connector.grid.selected_data",
  "catalog_kind": "connector",
  "runtime_key": "grid.selected_data",
  "status": "active",
  "title": "Grid Selected Data",
  "source": {
    "repository": "https://github.com/wrangleworks/WranglesPY",
    "revision": "bd5f88fba479ec406b409cb2880689c54e72b298",
    "version": "1.20.5",
    "extraction": "static-python-ast"
  },
  "operations": {
    "read": {
      "type": "object",
      "description": "Read the selected data supplied to this recipe invocation. Grid applications supply the current batch of selected rows. Within a recipe wrangle, this is the current parent dataframe, including any preceding transformations. Missing or empty selected data raises an error.",
      "additionalProperties": false,
      "properties": {
        "columns": {
          "$ref": "https://docs.wrangles.com/schemas/recipes/registry/schema.json#/$defs/write/commonProperties/columns"
        },
        "not_columns": {
          "$ref": "https://docs.wrangles.com/schemas/recipes/registry/schema.json#/$defs/write/commonProperties/not_columns"
        },
        "where": {
          "$ref": "https://docs.wrangles.com/schemas/recipes/registry/schema.json#/$defs/write/commonProperties/where"
        },
        "where_params": {
          "$ref": "https://docs.wrangles.com/schemas/recipes/registry/schema.json#/$defs/write/commonProperties/where_params"
        },
        "order_by": {
          "$ref": "https://docs.wrangles.com/schemas/recipes/registry/schema.json#/$defs/write/commonProperties/order_by"
        },
        "if": {
          "$ref": "https://docs.wrangles.com/schemas/recipes/registry/schema.json#/$defs/write/commonProperties/if"
        }
      }
    }
  },
  "description": "Read the selected data supplied to this recipe invocation. Grid applications supply the current batch of selected rows. Within a recipe wrangle, this is the current parent dataframe, including any preceding transformations. Missing or empty selected data raises an error.",
  "slug": "connectors/grid.selected_data",
  "visibility": "public",
  "sources": [
    {
      "id": "runtime",
      "resource": "https://github.com/wrangleworks/WranglesPY/tree/bd5f88fba479ec406b409cb2880689c54e72b298",
      "title": "Pinned WranglesPY connector schema"
    },
    {
      "id": "documentation-search",
      "resource": "https://wrangles.io/python/connectors/grid/selected_data",
      "title": "Checked for matching guide; no matching material retrieved. Description derived from pinned schema."
    }
  ],
  "guidance": "Read the selected data supplied to this recipe invocation. Grid applications supply the current batch of selected rows. Within a recipe wrangle, this is the current parent dataframe, including any preceding transformations. Missing or empty selected data raises an error."
}
